,Link,Name,Title
0,http://proceedings.mlr.press/v97/abbati19a/abbati19a.pdf,14a32824a4c9fd18c6858acf9336ba107fbea9e8,AReS and MaRS Adversarial and MMD-Minimizing Regression for SDEs
1,http://proceedings.mlr.press/v97/abels19a/abels19a.pdf,543af8e422f038279698c23a44b08104f780f49e,Dynamic Weights in Multi-Objective Deep Reinforcement Learning
2,http://proceedings.mlr.press/v97/abu-el-haija19a/abu-el-haija19a.pdf,2bb4396634851b6770efcd1bcf8427a0e6b3b738,MixHop: Higher-Order Graph Convolutional Architectures via Sparsified Neighborhood Mixing
3,http://proceedings.mlr.press/v97/acharya19a/acharya19a.pdf,233a49286d3dbe684d9396709ee4c54d23078967,Communication-Constrained Inference and the Role of Shared Randomness
4,http://proceedings.mlr.press/v97/acharya19b/acharya19b.pdf,b1330aca6a6bb4b30e236003a80e6a566a8a0f67,Distributed Learning with Sublinear Communication
5,http://proceedings.mlr.press/v97/acharya19c/acharya19c.pdf,18c121218baaeea90edabe28a120afa9c090fecb,Communication Complexity in Locally Private Distribution Estimation and Heavy Hitters
6,http://proceedings.mlr.press/v97/adams19a/adams19a.pdf,e26d314816fbbbb5c1e5725afa7b5ec5c3e5d640,Learning Models from Data with Measurement Error: Tackling Underreporting
7,http://proceedings.mlr.press/v97/adel19a/adel19a.pdf,740d6b88a69470607658118d1f67c17f64309019,TibGM: A Transferable and Information-Based Graphical Model Approach for Reinforcement Learning
8,http://proceedings.mlr.press/v97/adiga19a/adiga19a.pdf,cd2ace92d46d25ecd7fc5c7bc885411a82799122,PAC Learnability of Node Functions in Networked Dynamical Systems
9,http://proceedings.mlr.press/v97/agarwal19a/agarwal19a.pdf,1cd9b7cc3939a2af976cb0585ea2d3603a0cd68d,Static Automatic Batching In TensorFlow
10,http://proceedings.mlr.press/v97/agarwal19b/agarwal19b.pdf,4caca10adcaec7673ca9e2813ab0d015040cad17,Efficient Full-Matrix Adaptive Regularization
11,http://proceedings.mlr.press/v97/agarwal19c/agarwal19c.pdf,8ec0e50e8314e394214f4766f965f6de325df43b,Online Control with Adversarial Disturbances
12,http://proceedings.mlr.press/v97/agarwal19d/agarwal19d.pdf,39498033a3886edf841f194cb4c72e10fba9abbb,Fair Regression: Quantitative Definitions and Reduction-Based Algorithms
13,http://proceedings.mlr.press/v97/agarwal19e/agarwal19e.pdf,210f9bc3c0231c3c991dec9f9762ac40616eb4d6,Learning to Generalize from Sparse and Underspecified Rewards
14,http://proceedings.mlr.press/v97/agrawal19a/agrawal19a.pdf,1138b6d23b9c031c4f5884fd3b3cd2b242a5c0a5,The Kernel Interaction Trick: Fast Bayesian Discovery of Pairwise Interactions in High Dimensions
15,http://proceedings.mlr.press/v97/ahmed19a/ahmed19a.pdf,0ab0c548fb3d678afb4842ffb054fce10ad4fe1e,Understanding the Impact of Entropy on Policy Optimization
16,http://proceedings.mlr.press/v97/aivodji19a/aivodji19a.pdf,c266991ca4e59a92dae6080ccdec1d4f593d2259,Fairwashing: the risk of rationalization
17,http://proceedings.mlr.press/v97/akimoto19a/akimoto19a.pdf,563eec9a000b0f22691f64817a02c85c57692c9b,Adaptive Stochastic Natural Gradient Method for One-Shot Neural Architecture Search
18,http://proceedings.mlr.press/v97/akrour19a/akrour19a.pdf,bea1574bff8ae6186c383fac962b7c42c4796453,Projections for Approximate Policy Iteration Algorithms
19,http://proceedings.mlr.press/v97/alaa19a/alaa19a.pdf,449e3e4b69f77f327b33a5f5b7f7304c404e9257,Validating Causal Inference Models via Influence Functions
20,http://proceedings.mlr.press/v97/albuquerque19a/albuquerque19a.pdf,4816b931a8f0b71985b63475758ed98367ff3a59,Multi-objective training of Generative Adversarial Networks with multiple discriminators
21,http://proceedings.mlr.press/v97/alet19a/alet19a.pdf,162e92fd1b807a0cc9cc5f842c68c0f93ea4a657,"Graph Element Networks: adaptive, structured computation and memory"
22,http://proceedings.mlr.press/v97/allen19a/allen19a.pdf,fa8c29685ea07ecee396c8ae436c7dab9dca66e5,Analogies Explained: Towards Understanding Word Embeddings
23,http://proceedings.mlr.press/v97/allen19b/allen19b.pdf,4d6f79184f36b8cf6e81ff83a93777dba04b1342,Infinite Mixture Prototypes for Few-shot Learning
24,http://proceedings.mlr.press/v97/allen-zhu19a/allen-zhu19a.pdf,5456e45d2a0b811c5bbadf6a9ff80318d70995c2,A Convergence Theory for Deep Learning via Over-Parameterization
25,http://proceedings.mlr.press/v97/alvi19a/alvi19a.pdf,05e8451aca5d6009f0a2173906d5189eb6faead5,Asynchronous Batch Bayesian Optimisation with Improved Local Penalisation
26,http://proceedings.mlr.press/v97/amin19a/amin19a.pdf,0fddd2ec26fd15dc2ed0c475a25f7acdca7126c1,Bounding User Contributions: A Bias-Variance Trade-off in Differential Privacy
27,http://proceedings.mlr.press/v97/ancona19a/ancona19a.pdf,1384d81d45887a9870bf47f2ebf0691eae111443,Explaining Deep Neural Networks with a Polynomial Time Algorithm for Shapley Value Approximation
28,http://proceedings.mlr.press/v97/anderton19a/anderton19a.pdf,0269ad501d44dcc29b68b78c006b386563026035,Scaling Up Ordinal Embedding: A Landmark Approach
29,http://proceedings.mlr.press/v97/anil19a/anil19a.pdf,01135b2ff353d74368170ceaa729fb50e63f7621,Sorting Out Lipschitz Function Approximation
30,http://proceedings.mlr.press/v97/antelmi19a/antelmi19a.pdf,100b3df4074952cfbb2270b73a2d86a8574db129,Sparse Multi-Channel Variational Autoencoder for the Joint Analysis of Heterogeneous Data
31,http://proceedings.mlr.press/v97/arazo19a/arazo19a.pdf,b758d07894e194e8972ec92b9adf1345bc1fb016,Unsupervised Label Noise Modeling and Loss Correction
32,http://proceedings.mlr.press/v97/arora19a/arora19a.pdf,ccc7bffcb912b5680863971ab569abc9bac63ef5,Fine-Grained Analysis of Optimization and Generalization for Overparameterized Two-Layer Neural Networks
33,http://proceedings.mlr.press/v97/assadi19a/assadi19a.pdf,7e5a4c3e3420fcb77a6249f6f318265de1518d04,Distributed Weighted Matching via Randomized Composable Coresets
34,http://proceedings.mlr.press/v97/assran19a/assran19a.pdf,f8c35c8c8e63938a9dca904e9fd25a21e61bac30,Stochastic Gradient Push for Distributed Deep Learning
35,http://proceedings.mlr.press/v97/astudillo19a/astudillo19a.pdf,60f06b13c7c9b402a1927f01b6b9ffe1894e2dcc,Bayesian Optimization of Composite Functions
36,http://proceedings.mlr.press/v97/atasu19a/atasu19a.pdf,1aa392cbf6ab13aceac5fa6e6e0ff792972a41cd,Linear-Complexity Data-Parallel Earth Mover\xe2\x80\x99s Distance Approximations
37,http://proceedings.mlr.press/v97/awan19a/awan19a.pdf,80f23f040d98578db62933dc4f9630af015e5c8c,Benefits and Pitfalls of the Exponential Mechanism with Applications to Hilbert Spaces and Functional PCA
38,http://proceedings.mlr.press/v97/aydore19a/aydore19a.pdf,645dd3f3e50675bf00fd851eae518f20c147854a,Feature Grouping as a Stochastic Regularizer for High-Dimensional Structured Data
39,http://proceedings.mlr.press/v97/ayed19a/ayed19a.pdf,bd3fa0648e45989dc8e43d8c58dea26931259648,Beyond the Chinese Restaurant and Pitman-Yor processes: Statistical Models with double power-law behavior
40,http://proceedings.mlr.press/v97/backurs19a/backurs19a.pdf,2a03aff2c8409316c838aae01f543c53df133a72,Scalable Fair Clustering
41,http://proceedings.mlr.press/v97/balaji19a/balaji19a.pdf,a9cd6befaff9a96381982994261f3d1f84b5231b,Entropic GANs meet VAEs: A Statistical Approach to Compute Sample Likelihoods in GANs
42,http://proceedings.mlr.press/v97/balcan19a/balcan19a.pdf,a9a20de8efc1b502018deed3a3e3aa29fa9ea2e1,Provable Guarantees for Gradient-Based Meta-Learning
43,http://proceedings.mlr.press/v97/balduzzi19a/balduzzi19a.pdf,92412ca0083daa131872651a9ba5dc437b47e0f2,Open-ended learning in symmetric zero-sum games
44,http://proceedings.mlr.press/v97/balin19a/balin19a.pdf,67a64c34d085914f724a8d6ff7981283797c16ae,Concrete Autoencoders: Differentiable Feature Selection and Reconstruction
45,http://proceedings.mlr.press/v97/bansal19a/bansal19a.pdf,5d6fd4e30e455ad7a83fc1ec8403c51f1197895c,HOList: An Environment for Machine Learning of Higher Order Logic Theorem Proving
46,http://proceedings.mlr.press/v97/bapst19a/bapst19a.pdf,a87d574495e5a68c631817d72b4c4f088c85b913,Structured agents for physical construction
47,http://proceedings.mlr.press/v97/baranchuk19a/baranchuk19a.pdf,8b6b07efb54ffb4829fce56380647db304bb0f54,Learning to Route in Similarity Graphs
48,http://proceedings.mlr.press/v97/barros19a/barros19a.pdf,ddf78ce1c25f1613fb274bc666ec1efdb8ed477d,A Personalized Affective Memory Model for Improving Emotion Recognition
49,http://proceedings.mlr.press/v97/bartlett19a/bartlett19a.pdf,3e27f6920c047f4a9b87c0358fc9c92c6ffb1f3e,Scale-free adaptive planning for deterministic dynamics & discounted rewards
50,http://proceedings.mlr.press/v97/basu19a/basu19a.pdf,c0f0dc48905c0fe16ad51fbb8a968d21c19d1fff,Pareto Optimal Streaming Unsupervised Classification
51,http://proceedings.mlr.press/v97/bateni19a/bateni19a.pdf,a01b56b47c43b86e43bfbc03228f8c879059b576,Categorical Feature Compression via Submodular Optimization
52,http://proceedings.mlr.press/v97/batson19a/batson19a.pdf,48dd0be9d0dac9a357231540f794050cb92fc5b9,Noise2Self: Blind Denoising by Self-Supervision
53,http://proceedings.mlr.press/v97/beatson19a/beatson19a.pdf,719f8be239ccd97e9b380d5ffd263cf3855017ad,Efficient optimization of loops and limits with randomized telescoping sums
54,http://proceedings.mlr.press/v97/becker19a/becker19a.pdf,f7ebb067261efe99256998cc50d47bc10111a410,Recurrent Kalman Networks: Factorized Inference in High-Dimensional Deep Feature Spaces
55,http://proceedings.mlr.press/v97/becker-ehmck19a/becker-ehmck19a.pdf,cea87cb77d26c0d2ad287e44072ad07de73b3380,Switching Linear Dynamics for Variational Bayes Filtering
56,http://proceedings.mlr.press/v97/behpour19a/behpour19a.pdf,9b9af6563c9a7c16283fc35a169b537cba6bbc43,Active Learning for Probabilistic Structured Prediction of Cuts and Matchings
57,http://proceedings.mlr.press/v97/behrmann19a/behrmann19a.pdf,9baf518eae8e5c5ff2902aa375fe3eac0e203f50,Invertible Residual Networks
58,http://proceedings.mlr.press/v97/belilovsky19a/belilovsky19a.pdf,11a8bd954f51ece3f87b7bb7916afa98a8991c92,Greedy Layerwise Learning Can Scale To ImageNet
59,http://proceedings.mlr.press/v97/benyahia19a/benyahia19a.pdf,2c3a27833dc7ca9712b534013ddc5f40ec079097,Overcoming Multi-model Forgetting
60,http://proceedings.mlr.press/v97/benzing19a/benzing19a.pdf,78364d1cb1cf7f3691750ad95656a95af77cc279,Optimal Kronecker-Sum Approximation of Real Time Recurrent Learning
61,http://proceedings.mlr.press/v97/bertran19a/bertran19a.pdf,110e961de66802bb50771e45e5bacbff4da03906,Adversarially Learned Representations for Information Obfuscation and Inference
62,http://proceedings.mlr.press/v97/beygelzimer19a/beygelzimer19a.pdf,a8cc94c64103b50c2d9c5e2f5d62e9889c66e130,Bandit Multiclass Linear Classification: Efficient Algorithms for the Separable Case
63,http://proceedings.mlr.press/v97/bhagoji19a/bhagoji19a.pdf,091280da50f3f03ed405a197860aa864531851b9,Analyzing Federated Learning through an Adversarial Lens
64,http://proceedings.mlr.press/v97/bian19a/bian19a.pdf,841d46dbf89a6ba2ef12f04254e5bbf04af9df8f,Optimal Continuous DR-Submodular Maximization and Applications to Provable Mean Field Inference
65,http://proceedings.mlr.press/v97/bibaut19a/bibaut19a.pdf,a7c8fe12be30dcfdea2b4170c25a8ae1e98cd35a,More Efficient Off-Policy Evaluation through Regularized Targeted Learning
66,http://proceedings.mlr.press/v97/bietti19a/bietti19a.pdf,bbfa04a679ffe70e53b1f99599ea446d6fee18cc,A Kernel Perspective for Regularizing Deep Neural Networks
67,http://proceedings.mlr.press/v97/blau19a/blau19a.pdf,44e03a41a7b654dbe6e1de0648195a27dda4a7f0,Rethinking Lossy Compression: The Rate-Distortion-Perception Tradeoff
68,http://proceedings.mlr.press/v97/boda19a/boda19a.pdf,82c7084628ffca454dcc1c87af611a889da79898,Correlated bandits or: How to minimize mean-squared error online
69,http://proceedings.mlr.press/v97/bojchevski19a/bojchevski19a.pdf,fb7ebf7549de90617e36cc6b0422917eff98caef,Adversarial Attacks on Node Embeddings via Graph Poisoning
70,http://proceedings.mlr.press/v97/borsos19a/borsos19a.pdf,db706b34eb09d4eb00469c02ded9ec0657e7ea62,Online Variance Reduction with Mixtures
71,http://proceedings.mlr.press/v97/bose19a/bose19a.pdf,e94830dfc2058a116aa49f2c7612da9f05292698,Compositional Fairness Constraints for Graph Embeddings
72,http://proceedings.mlr.press/v97/bouthillier19a/bouthillier19a.pdf,7b46a2d9519848ef3dd6061da0cbd349262bde07,Unreproducible Research is Reproducible
73,http://proceedings.mlr.press/v97/braun19a/braun19a.pdf,309fe5afee83bf189a25fa87b517e419f55074d8,Blended Conditonal Gradients
74,http://proceedings.mlr.press/v97/braverman19a/braverman19a.pdf,180fe96b7eaf6e9f64b4988e3fd0e22ade8dc256,Coresets for Ordered Weighted Clustering
75,http://proceedings.mlr.press/v97/bregere19a/bregere19a.pdf,badc146238e4dcf59235a295ee32ef404c7fa31a,Target Tracking for Contextual Bandits: Application to Demand Side Management
76,http://proceedings.mlr.press/v97/bridges19a/bridges19a.pdf,0f89916c8273f2dadbb5a2fcb3d49f413f50e25d,Active Manifolds: A non-linear analogue to Active Subspaces
77,http://proceedings.mlr.press/v97/brookes19a/brookes19a.pdf,101725b0ac62f01479edff2d0cf9666f37a4294f,Conditioning by adaptive sampling for robust design
78,http://proceedings.mlr.press/v97/brown19a/brown19a.pdf,31daa67beaeed80ef32c9c0732a48b34ad706493,Extrapolating Beyond Suboptimal Demonstrations via Inverse Reinforcement Learning from Observations
79,http://proceedings.mlr.press/v97/brown19b/brown19b.pdf,ebb0417fe1a66467506f1cdcb2c3e7b83d06553c,Deep Counterfactual Regret Minimization
80,http://proceedings.mlr.press/v97/brunet19a/brunet19a.pdf,d666f6ed55584d56a30eb8cdf8e33a2c2f0b6008,Understanding the Origins of Bias in Word Embeddings
81,http://proceedings.mlr.press/v97/brutzkus19a/brutzkus19a.pdf,982b7e757913051d1bca0bf14d2c564dd1dee9bf,Low Latency Privacy Preserving Inference
82,http://proceedings.mlr.press/v97/brutzkus19b/brutzkus19b.pdf,ad56d6d23717a6da3753da34d83b33ea118cc307,Why do Larger Models Generalize Better? A Theoretical Perspective via the XOR Problem
83,http://proceedings.mlr.press/v97/bubeck19a/bubeck19a.pdf,90f18842384a4b3583aa67bcaa6157e83a750e66,Adversarial examples from computational constraints
84,http://proceedings.mlr.press/v97/buchnik19a/buchnik19a.pdf,07133f17120423e57ae9ac05b050bfd16d4df455,Self-similar Epochs: Value in arrangement
85,http://proceedings.mlr.press/v97/bunne19a/bunne19a.pdf,35333c978dd5b3c074f2750830a6bb6be1df8300,Learning Generative Models across Incomparable Spaces
86,http://proceedings.mlr.press/v97/burt19a/burt19a.pdf,fc6034d9aace8135dc0c2289beca386f64b63bde,Rates of Convergence for Sparse Variational Gaussian Process Regression
87,http://proceedings.mlr.press/v97/byrd19a/byrd19a.pdf,a9ec7baf158fd5c99ce60a962999c7690cd0eac3,What is the Effect of Importance Weighting in Deep Learning?
88,http://proceedings.mlr.press/v97/cai19a/cai19a.pdf,c1789d789b584fbd888eb1dc8b7ace15ad192518,A Quantitative Analysis of the Effect of Batch Normalization on Gradient Descent
89,http://proceedings.mlr.press/v97/can19a/can19a.pdf,b54f5c147a0e3823698636c66ea297b84c7ff0ad,Accelerated Linear Convergence of Stochastic Momentum Methods in Wasserstein Distances
90,http://proceedings.mlr.press/v97/canal19a/canal19a.pdf,34b990108b78c92fba9d54165756745c576ff3d6,Active Embedding Search via Noisy Paired Comparisons
91,http://proceedings.mlr.press/v97/cao19a/cao19a.pdf,01980990e3ef78670d14b89b16b916de4662aa44,Dynamic Learning with Frequent New Product Launches: A Sequential Multinomial Logit Bandit Problem
92,http://proceedings.mlr.press/v97/cardoso19a/cardoso19a.pdf,bed3c42312d1735f55d15bf68c6c1ac63eb9c118,Competing Against Nash Equilibria in Adversarially Changing Zero-Sum Games
93,http://proceedings.mlr.press/v97/chai19a/chai19a.pdf,221d7af2f2181bee3b07f206693675b9bb2f5f0f,Automated Model Selection with Bayesian Quadrature
94,http://proceedings.mlr.press/v97/chandak19a/chandak19a.pdf,39f7f4326aed29674fbfe9f0104d52a0984a4053,Learning Action Representations for Reinforcement Learning
95,http://proceedings.mlr.press/v97/chang19a/chang19a.pdf,c0acf1c38d4d0d0ec1c68d5df20265efbc2182f0,Dynamic Measurement Scheduling for Event Forecasting using Deep RL
96,http://proceedings.mlr.press/v97/charoenphakdee19a/charoenphakdee19a.pdf,874f7b63e1c9710ed7affd8f86b2c6be3bd7e3df,On Symmetric Losses for Learning from Corrupted Labels
97,http://proceedings.mlr.press/v97/chatterji19a/chatterji19a.pdf,ae7fe940a05ce8ebc980e665515a41dfd14702bc,Online learning with kernel losses
98,http://proceedings.mlr.press/v97/chattopadhyay19a/chattopadhyay19a.pdf,9361e3ac4d4d6d5a0c3d6d5f4cfb6958acf13a75,Neural Network Attributions: A Causal Perspective
99,http://proceedings.mlr.press/v97/chaudhuri19a/chaudhuri19a.pdf,a87e582b64d3f0af700208dffb758e38f48c1112,PAC Identification of Many Good Arms in Stochastic Multi-Armed Bandits
100,http://proceedings.mlr.press/v97/chen19a/chen19a.pdf,680b7f74a92d3a696285c465c1daa61e72bc1ad1,Nearest Neighbor and Kernel Survival Analysis: Nonasymptotic Error Bounds and Strong Consistency Rates
101,http://proceedings.mlr.press/v97/chen19b/chen19b.pdf,793d69ed7d0ca5af37c6090fd371a8938635c501,Stein Point Markov Chain Monte Carlo
102,http://proceedings.mlr.press/v97/chen19c/chen19c.pdf,d9595ce64c2b6367f7262140c0a26f5466fc8bf6,Particle Flow Bayes\xe2\x80\x99 Rule
103,http://proceedings.mlr.press/v97/chen19d/chen19d.pdf,284c7a9fb2d322aa3a5d83388cecfa9dfb4cdafc,Proportionally Fair Clustering
104,http://proceedings.mlr.press/v97/chen19e/chen19e.pdf,b8f8ce25675d04948e3b11ee069fd65b011f14ae,Information-Theoretic Considerations in Batch Reinforcement Learning
105,http://proceedings.mlr.press/v97/chen19f/chen19f.pdf,1aa6a0a7e674c116ed1c93c85a699e7e9f2143c4,Generative Adversarial User Model for Reinforcement Learning Based Recommendation System
106,http://proceedings.mlr.press/v97/chen19g/chen19g.pdf,3621e82feddc25eeed6136eca5dcdca80faad055,Understanding and Utilizing Deep Neural Networks Trained with Noisy Labels
107,http://proceedings.mlr.press/v97/chen19h/chen19h.pdf,d7189093c452a0039e3edf26d9c1f087099fc71e,"A Gradual, Semi-Discrete Approach to Generative Network Training via Explicit Wasserstein Minimization"
108,http://proceedings.mlr.press/v97/chen19i/chen19i.pdf,a11085559f10802f9957ebbf4257ca38b886ab37,Transferability vs. Discriminability: Batch Spectral Penalization for Adversarial Domain Adaptation
109,http://proceedings.mlr.press/v97/chen19j/chen19j.pdf,b57a84933a972a7bd0c9ed417c1db788f1037ca7,"Fast Incremental von Neumann Graph Entropy Computation: Theory, Algorithm, and Applications"
110,http://proceedings.mlr.press/v97/chen19k/chen19k.pdf,1992b3809efccc4da9d30a5aa3f16572b4c74168,Katalyst: Boosting Convex Katayusha for Non-Convex Problems with a Large Condition Number
111,http://proceedings.mlr.press/v97/chen19l/chen19l.pdf,0f893208744e6a37959b597d4d34ca786963acbc,Multivariate-Information Adversarial Ensemble for Scalable Joint Distribution Matching
112,http://proceedings.mlr.press/v97/chen19m/chen19m.pdf,9f94ed6a64cfaec813695bcf45aecdc71cc0e0e0,Robust Decision Trees Against Adversarial Examples
113,http://proceedings.mlr.press/v97/chen19n/chen19n.pdf,93604c0b34f5875598e5ffe6050eb05dc2054376,RaFM: Rank-Aware Factorization Machines
114,http://proceedings.mlr.press/v97/cheng19a/cheng19a.pdf,1094cbb0d583d6f98482360200a6d299374acdd5,Control Regularization for Reduced Variance Reinforcement Learning
115,http://proceedings.mlr.press/v97/cheng19b/cheng19b.pdf,ed8e2bc8b6f38e2464bd14d0083ceb039a998203,Predictor-Corrector Policy Optimization
116,http://proceedings.mlr.press/v97/chiquet19a/chiquet19a.pdf,49ba712ad4dc513d1495210f6ff3ebe8ae1a1d73,Variational Inference for sparse network reconstruction from count data
117,http://proceedings.mlr.press/v97/chitra19a/chitra19a.pdf,84957edc566275fc30b56e3712c8f235ed24fc3a,Random Walks on Hypergraphs with Edge-Dependent Vertex Weights
118,http://proceedings.mlr.press/v97/choi19a/choi19a.pdf,0c56e0672322069ce7855152a35ce1b89e0fb44b,Neural Joint Source-Channel Coding
119,http://proceedings.mlr.press/v97/choromanska19a/choromanska19a.pdf,8c13d463a31afbb2c42d2c0012987e0c969a8cb7,Beyond Backprop: Online Alternating Minimization with Auxiliary Variables
120,http://proceedings.mlr.press/v97/choromanski19a/choromanski19a.pdf,934f4f4cf1e592f7af752ff225070389e3331760,Unifying Orthogonal Monte Carlo Methods
121,http://proceedings.mlr.press/v97/chu19a/chu19a.pdf,22081a5e6822cfa1639df6fa6ed013c45be9ca17,"Probability Functional Descent: A Unifying Perspective on GANs, Variational Inference, and Reinforcement Learning"
122,http://proceedings.mlr.press/v97/chu19b/chu19b.pdf,9c362988bf83586b5a58037b965acd44482ec52b,MeanSum: A Neural Model for Unsupervised Multi-Document Abstractive Summarization
123,http://proceedings.mlr.press/v97/chung19a/chung19a.pdf,0a4c01864fa0afaa494e310362d5fc30eb5ae2af,Weak Detection of Signal in the Spiked Wigner Model
124,http://proceedings.mlr.press/v97/cicalese19a/cicalese19a.pdf,d094091056a806033f9b667ec58d2e575da3fae5,New results on information theoretic clustering
125,http://proceedings.mlr.press/v97/cinelli19a/cinelli19a.pdf,f1504eaacb0311ac69b2dffe6b5eaa6f0dd9356c,Sensitivity Analysis of Linear Structural Causal Models
126,http://proceedings.mlr.press/v97/clarkson19a/clarkson19a.pdf,bddeaaf307675daf76698f8f0e27543b92122941,Dimensionality Reduction for Tukey Regression
127,http://proceedings.mlr.press/v97/clemencon19a/clemencon19a.pdf,9d2df8725610a6f81c004b0dbd24634b084504f1,On Medians of (Randomized) Pairwise Means
128,http://proceedings.mlr.press/v97/cobbe19a/cobbe19a.pdf,8ba410601056f08c47b8ed368732d304819e9a39,Quantifying Generalization in Reinforcement Learning
129,http://proceedings.mlr.press/v97/cohen19a/cohen19a.pdf,292139d9f94a02d2cd20f3d6f6d95309b4052dc9,Empirical Analysis of Beam Search Performance Degradation in Neural Sequence Models
130,http://proceedings.mlr.press/v97/cohen19b/cohen19b.pdf,c55644e40b3385ed06cf836102f5d01223a899c8,Learning Linear-Quadratic Regulators Efficiently with only $\\sqrtT$ Regret
131,http://proceedings.mlr.press/v97/cohen19c/cohen19c.pdf,fb2070729997e6e1fac3e9a27a13fc55bb4e1d4d,Certified Adversarial Robustness via Randomized Smoothing
132,http://proceedings.mlr.press/v97/cohen19d/cohen19d.pdf,09db5a16c41a917f2fe082a3ce55980625077d16,Gauge Equivariant Convolutional Networks and the Icosahedral CNN
133,http://proceedings.mlr.press/v97/colas19a/colas19a.pdf,52f523ad0a5b468b30b14a1f1022c954f40de1c2,CURIOUS: Intrinsically Motivated Modular Multi-Goal Reinforcement Learning
134,http://proceedings.mlr.press/v97/collobert19a/collobert19a.pdf,08113fd3c2f932eae3ea49c95528a428e7c230ec,A fully differentiable beam search decoder
135,http://proceedings.mlr.press/v97/cornish19a/cornish19a.pdf,d46acd02cee39ab24385d6caf6f8e6e122bc884c,Scalable Metropolis-Hastings for Exact Bayesian Inference with Large Datasets
136,http://proceedings.mlr.press/v97/correa19a/correa19a.pdf,51ff689d51e53036f79ddbab19de0b36ef650079,Adjustment Criteria for Generalizing Experimental Findings
137,http://proceedings.mlr.press/v97/cortes19a/cortes19a.pdf,724d6fe70ca2cfdd969518cc59eb70c06ead1323,Online Learning with Sleeping Experts and Feedback Graphs
138,http://proceedings.mlr.press/v97/cortes19b/cortes19b.pdf,129762c27e98d5ed12669a7ec2f47ae9bc088572,Active Learning with Disagreement Graphs
139,http://proceedings.mlr.press/v97/cotter19a/cotter19a.pdf,635f65403b6ff95f1754d8400271939d4a7a227b,Shape Constraints for Set Functions
140,http://proceedings.mlr.press/v97/cotter19b/cotter19b.pdf,772c96ab805ce70610142d33b5faaacace5ca2d8,Training Well-Generalizing Classifiers for Fairness Metrics and Other Data-Dependent Constraints
141,http://proceedings.mlr.press/v97/cranko19a/cranko19a.pdf,7d95425ae9fa3c286c3a7f4ede56a8ddff0fa8aa,Monge blunts Bayes: Hardness Results for Adversarial Training
142,http://proceedings.mlr.press/v97/cranko19b/cranko19b.pdf,772e122911b95d314cba6a328de5ff80e2376f7d,Boosted Density Estimation Remastered
143,http://proceedings.mlr.press/v97/crawford19a/crawford19a.pdf,24e25a8e76c85d9ac87e3f920ced4ee603c63384,Submodular Cost Submodular Cover with an Approximate Oracle
144,http://proceedings.mlr.press/v97/creager19a/creager19a.pdf,b9b7cf71d15efeee8c157fcdc26b308e41e071ee,Flexibly Fair Representation Learning by Disentanglement
145,http://proceedings.mlr.press/v97/cutkosky19a/cutkosky19a.pdf,d49b9ec7678dfd4c2d40b828940b442227605b8c,"Anytime Online-to-Batch, Optimism and Acceleration"
146,http://proceedings.mlr.press/v97/cutkosky19b/cutkosky19b.pdf,3b482a362f533483b4fc869562263d7c01ac7ac1,Matrix-Free Preconditioning in Online Learning
147,http://proceedings.mlr.press/v97/cvitkovic19a/cvitkovic19a.pdf,0b01684aa87a73244b5398c77ad2eb55f2eb75d5,Minimal Achievable Sufficient Statistic Learning
148,http://proceedings.mlr.press/v97/cvitkovic19b/cvitkovic19b.pdf,d31be3c3e6773396e2c7affcc76b7a9531aabad1,Open Vocabulary Learning on Source Code with a Graph-Structured Cache
149,http://proceedings.mlr.press/v97/dadashi19a/dadashi19a.pdf,10171fef847969326f4b3aed6e0c5822d40415dd,The Value Function Polytope in Reinforcement Learning
150,http://proceedings.mlr.press/v97/dai19a/dai19a.pdf,dcf26e859db575a6e5a6266408584d0d19979340,Bayesian Optimization Meets Bayesian Optimal Stopping
151,http://proceedings.mlr.press/v97/dann19a/dann19a.pdf,5fdea957bc4db66c803032b589d42f54c362e8c6,Policy Certificates: Towards Accountable Reinforcement Learning
152,http://proceedings.mlr.press/v97/dao19a/dao19a.pdf,7e7f7bcf37b721404c809269aa945396de8a75d7,Learning Fast Algorithms for Linear Transforms Using Butterfly Factorizations
153,http://proceedings.mlr.press/v97/dao19b/dao19b.pdf,e78329906df80406e9e908711a8ae540a4344d54,A Kernel Theory of Modern Data Augmentation
154,http://proceedings.mlr.press/v97/das19a/das19a.pdf,34bd363b700b43c56d2ffb277f3e41b534b5d33c,TarMAC: Targeted Multi-Agent Communication
155,http://proceedings.mlr.press/v97/dasgupta19a/dasgupta19a.pdf,b7efbca7360ed59495d580213d46efdb4adb4f1b,Teaching a black-box learner
156,http://proceedings.mlr.press/v97/de-bie19a/de-bie19a.pdf,910b3b0bf22a3243eb39199f92faf616c19248cc,Stochastic Deep Networks
