,Link,Name,Title
157,http://proceedings.mlr.press/v97/denevi19a/denevi19a.pdf,e7fae1eb3fcd7ab3ea8b1aafa8017da8e4467d19,Learning-to-Learn Stochastic Gradient Descent with Biased Regularization
158,http://proceedings.mlr.press/v97/dereli19a/dereli19a.pdf,040e7f0f3ca3b9d9d91de7e9693aab2d8fef59df,A Multitask Multiple Kernel Learning Algorithm for Survival Analysis with Application to Cancer Biology
159,http://proceedings.mlr.press/v97/diaconu19a/diaconu19a.pdf,2cbe15da97642117ec4597d06ebe09f51a41ecab,Learning to Convolve: A Generalized Weight-Tying Approach
160,http://proceedings.mlr.press/v97/diakonikolas19a/diakonikolas19a.pdf,6197b600d4178520110fde2705f2224198a6d85b,Sever: A Robust Meta-Algorithm for Stochastic Optimization
161,http://proceedings.mlr.press/v97/ding19a/ding19a.pdf,6394d731cf7a28691d54a17df6cf75b984818d44,Approximated Oracle Filter Pruning for Destructive CNN Width Optimization
162,http://proceedings.mlr.press/v97/ding19b/ding19b.pdf,6af22484068c1cba2db5607a282f755f9e7d201b,Noisy Dual Principal Component Pursuit
163,http://proceedings.mlr.press/v97/doan19a/doan19a.pdf,6dae7b682d12a098297a475ca72b3e4406d29aa9,Finite-Time Analysis of Distributed TD(0) with Linear Function Approximation on Multi-Agent Reinforcement Learning
164,http://proceedings.mlr.press/v97/doerr19a/doerr19a.pdf,48ab0ef3f8b0d7277b41723f15750e92d7dbed01,Trajectory-Based Off-Policy Deep Reinforcement Learning
165,http://proceedings.mlr.press/v97/dohmatob19a/dohmatob19a.pdf,933f88dd36a5fc7ba9ab785dcad58f497fa153be,Generalized No Free Lunch Theorem for Adversarial Robustness
166,http://proceedings.mlr.press/v97/du19a/du19a.pdf,a2e414ce2154cdeba73d8d9e3fb057d87dac494b,Width Provably Matters in Optimization for Deep Linear Neural Networks
167,http://proceedings.mlr.press/v97/du19b/du19b.pdf,b9d1b0c9ad6029a0789c47e575059d8337369b97,Provably efficient RL with Rich Observations via Latent State Decoding
168,http://proceedings.mlr.press/v97/du19c/du19c.pdf,1e75b57cb8a1ca55390c5ca4efa5b53fdee0c9f5,Gradient Descent Finds Global Minima of Deep Neural Networks
169,http://proceedings.mlr.press/v97/du19d/du19d.pdf,6810b346d4d068ea6eb82e8977001f7a66e02990,Incorporating Grouping Information into Bayesian Decision Tree Ensembles
170,http://proceedings.mlr.press/v97/du19e/du19e.pdf,be9e1d3a5f101ee632134f36d893e8fc9d0b48a5,Task-Agnostic Dynamics Priors for Deep Reinforcement Learning
171,http://proceedings.mlr.press/v97/duetting19a/duetting19a.pdf,1f3a2966055ade10d884fd09ad51cc2f8cbb3784,Optimal Auctions through Deep Learning
172,http://proceedings.mlr.press/v97/dukler19a/dukler19a.pdf,746a536de58caca884d9517de04e1d3f7acaa632,Wasserstein of Wasserstein Loss for Learning Generative Models
173,http://proceedings.mlr.press/v97/duncker19a/duncker19a.pdf,7b4760e19c89d46ed4f77f963f8fb9e325f8e28e,Learning interpretable continuous-time models of latent stochastic dynamical systems
174,http://proceedings.mlr.press/v97/durkan19a/durkan19a.pdf,f647455c2456da35cc4da6d378a0a4ac15967b25,Autoregressive Energy Machines
175,http://proceedings.mlr.press/v97/dziedzic19a/dziedzic19a.pdf,8ffec1f777b0a8a084660d835b91183aecc1a63b,Band-limited Training and Inference for Convolutional Neural Networks
176,http://proceedings.mlr.press/v97/edwards19a/edwards19a.pdf,7a6cbf73a4ebd689d386e7d7653eb9f827265f39,Imitating Latent Policies from Observation
177,http://proceedings.mlr.press/v97/eichner19a/eichner19a.pdf,79ee0d837f6d6c60d596bdd59d109243f2df1e31,Semi-Cyclic Stochastic Gradient Descent
178,http://proceedings.mlr.press/v97/elfeki19a/elfeki19a.pdf,24be279c3c82c5862369258680fc5934d8edce44,GDPP: Learning Diverse Generations using Determinantal Point Processes
179,http://proceedings.mlr.press/v97/elhamifar19a/elhamifar19a.pdf,cc7c9723a6cebe4e6375c382ba5485207a5a3663,Sequential Facility Location: Approximate Submodularity and Greedy Algorithm
180,http://proceedings.mlr.press/v97/ene19a/ene19a.pdf,4150f7b8f7dad07afea9de3dfd6b64bed5781c88,Improved Convergence for $\\ell_1$ and $\\ell_\xe2\x88\x9e$ Regression via Iteratively Reweighted Least Squares
181,http://proceedings.mlr.press/v97/engstrom19a/engstrom19a.pdf,5da0f94ee513de0e3d7f13a6d9787ed17fe9ca88,Exploring the Landscape of Spatial Robustness
182,http://proceedings.mlr.press/v97/esteves19a/esteves19a.pdf,d87e45979711d4dec6653f0276691c26e7fee432,Cross-Domain 3D Equivariant Image Embeddings
183,http://proceedings.mlr.press/v97/etmann19a/etmann19a.pdf,a78ed2f2c69a8a9a1590f8cca7519486c7acc432,On the Connection Between Adversarial Robustness and Saliency Map Interpretability
184,http://proceedings.mlr.press/v97/fahrbach19a/fahrbach19a.pdf,768fd5fef417b79cd5885e6c6279a7e44bd33af2,Non-monotone Submodular Maximization with Nearly Optimal Adaptivity and Query Complexity
185,http://proceedings.mlr.press/v97/fan19a/fan19a.pdf,c4e6d0172e16119057c8c03a424023ce6d3b2481,Multi-Frequency Vector Diffusion Maps
186,http://proceedings.mlr.press/v97/farina19a/farina19a.pdf,9d3a12db6835fcf574242a4d7b160427e8236d55,Stable-Predictive Optimistic Counterfactual Regret Minimization
187,http://proceedings.mlr.press/v97/farina19b/farina19b.pdf,d351162e2afdd3ca942da2823cb0cc9a5780ee6a,Regret Circuits: Composability of Regret Minimizers
188,http://proceedings.mlr.press/v97/fatemi19a/fatemi19a.pdf,b7900558f0ce1bd403eae55537765c8c69192f74,Dead-ends and Secure Exploration in Reinforcement Learning
189,http://proceedings.mlr.press/v97/feige19a/feige19a.pdf,8f0734a6a7c6a3486527e43ba70b3af12c04fd2a,Invariant-Equivariant Representation Learning for Multi-Class Data
190,http://proceedings.mlr.press/v97/feldman19a/feldman19a.pdf,c76198133bc5ddef3ef55d88dbdda974fb77bcee,The advantages of multiple classes for reducing overfitting from test set reuse
191,http://proceedings.mlr.press/v97/feraud19a/feraud19a.pdf,0b52ff8fbc5096e1513aae3b0180ae6dc229cb64,Decentralized Exploration in Multi-Armed Bandits
192,http://proceedings.mlr.press/v97/fercoq19a/fercoq19a.pdf,a6c74acfe155e42310dc156c2924963081be80b8,Almost surely constrained convex optimization
193,http://proceedings.mlr.press/v97/finn19a/finn19a.pdf,0c89baabff4a280732008dc75c7dad11311b7b43,Online Meta-Learning
194,http://proceedings.mlr.press/v97/fischer19a/fischer19a.pdf,a19631350aaf7c26242d112754fc49bcf4e8c419,DL2: Training and Querying Neural Networks with Logic
195,http://proceedings.mlr.press/v97/foerster19a/foerster19a.pdf,3ce233970205852da3fecbe99f65cfbfa24141f2,Bayesian Action Decoder for Deep Multi-Agent Reinforcement Learning
196,http://proceedings.mlr.press/v97/fong19a/fong19a.pdf,583b470eadbcab17cfa8932a096b404dc4ec10d8,Scalable Nonparametric Sampling from Multimodal Posteriors with the Posterior Bootstrap
197,http://proceedings.mlr.press/v97/franc19a/franc19a.pdf,7e30547e1df27c80453675251afad3450519ce4b,On discriminative learning of prediction uncertainty
198,http://proceedings.mlr.press/v97/franceschi19a/franceschi19a.pdf,51583ddd6474b3fb6e52a5c57f9ff8ac54bc7f66,Learning Discrete Structures for Graph Neural Networks
199,http://proceedings.mlr.press/v97/freirich19a/freirich19a.pdf,bc97e599ac1bbbec614cc5f0b65ae08d7122d7be,Distributional Multivariate Policy Evaluation and Exploration with the Bellman GAN
200,http://proceedings.mlr.press/v97/frerix19a/frerix19a.pdf,c67aeaca4f7d7564e547a83b9ab3e2194fe53505,Approximating Orthogonal Matrices with Effective Givens Factorization
201,http://proceedings.mlr.press/v97/frogner19a/frogner19a.pdf,62ae0d33a5d6193e50bb0a5d301c4c412418dcac,Fast and Flexible Inference of Joint Distributions from their Marginals
202,http://proceedings.mlr.press/v97/frosst19a/frosst19a.pdf,b2948f48a8daf438da232cbb993cb6bfefbe50ea,Analyzing and Improving Representations with the Soft Nearest Neighbor Loss
203,http://proceedings.mlr.press/v97/fu19a/fu19a.pdf,bc16ba3b33ae9d982ac60daa08822f04639d8c77,Diagnosing Bottlenecks in Deep Q-learning Algorithms
204,http://proceedings.mlr.press/v97/fu19b/fu19b.pdf,7abbc949c938dd8a160b4f9caa2f15fec02eacd6,MetricGAN: Generative Adversarial Networks based Black-box Metric Scores Optimization for Speech Enhancement
205,http://proceedings.mlr.press/v97/fujii19a/fujii19a.pdf,fd839af4468eaefdf7c6200bd42c9f9fffe3cf8e,Beyond Adaptive Submodularity: Approximation Guarantees of Greedy Policy with Adaptive Submodularity Ratio
206,http://proceedings.mlr.press/v97/fujimoto19a/fujimoto19a.pdf,5fe53964f626b4e4225e37af9feb822a6eda2f03,Off-Policy Deep Reinforcement Learning without Exploration
207,http://proceedings.mlr.press/v97/gamrian19a/gamrian19a.pdf,efc582487ff838357599fd61b453438e074069d4,Transfer Learning for Related Reinforcement Learning Tasks via Image-to-Image Translation
208,http://proceedings.mlr.press/v97/ganea19a/ganea19a.pdf,8e8509c9d9a11e359a84e233bdeb30322fe4060c,Breaking the Softmax Bottleneck via Learnable Monotonic Pointwise Non-linearities
209,http://proceedings.mlr.press/v97/gao19a/gao19a.pdf,52b6e6eb056a1e4b3fb7d05f18dee9f97c3188bd,Graph U-Nets
210,http://proceedings.mlr.press/v97/gao19b/gao19b.pdf,afdedda29552ba0b5bdbb9fade6e1296a4daec15,Deep Generative Learning via Variational Gradient Flow
211,http://proceedings.mlr.press/v97/gao19c/gao19c.pdf,b9eb444514eab78a2abc67f0f2e908a037053a22,Rate Distortion For Model Compression:From Theory To Practice
212,http://proceedings.mlr.press/v97/gao19d/gao19d.pdf,cb2f70553acb369fa569a15fb3fb7540705da941,Demystifying Dropout
213,http://proceedings.mlr.press/v97/gao19e/gao19e.pdf,270024d379eada9002b5b3f2182eef80b79d758c,Geometric Scattering for Graph Data Analysis
214,http://proceedings.mlr.press/v97/gao19f/gao19f.pdf,2cf0d4b0e19b296647a6fc6cf0e5ee1036b9476a,Multi-Frequency Phase Synchronization
215,http://proceedings.mlr.press/v97/gazagnadou19a/gazagnadou19a.pdf,98eb6aba5bab3708ca40355b65b28b528466ebb2,Optimal Mini-Batch and Step Sizes for SAGA
216,http://proceedings.mlr.press/v97/geifman19a/geifman19a.pdf,86db523cd006fe22f9e42012f546040d6516fe3f,SelectiveNet: A Deep Neural Network with an Integrated Reject Option
217,http://proceedings.mlr.press/v97/geist19a/geist19a.pdf,abd08f6f5d1dd3ba1fe3949292c6b920cf7ae597,A Theory of Regularized Markov Decision Processes
218,http://proceedings.mlr.press/v97/gelada19a/gelada19a.pdf,28f913e497751dec73d5114e2ae028820ec43a27,DeepMDP: Learning Continuous Latent Space Models for Representation Learning
219,http://proceedings.mlr.press/v97/geng19a/geng19a.pdf,0cacb3de68f68b662995f233e2fe1f46bc2c199b,Partially Linear Additive Gaussian Graphical Models
220,http://proceedings.mlr.press/v97/ghadikolaei19a/ghadikolaei19a.pdf,946172edbe555346a7ce1768bbcd6d23085bce08,Learning and Data Selection in Big Datasets
221,http://proceedings.mlr.press/v97/ghaffari19a/ghaffari19a.pdf,00fefc017c3910d3e40e01102bbf3398e24b6be2,Improved Parallel Algorithms for Density-Based Network Clustering
222,http://proceedings.mlr.press/v97/ghazi19a/ghazi19a.pdf,f37bc923402e83ce6a50e25509489750deb73fc7,Recursive Sketches for Modular Deep Learning
223,http://proceedings.mlr.press/v97/ghorbani19a/ghorbani19a.pdf,79726a0bf94dc3b2a25bc0f906bf64034a2ef45c,An Instability in Variational Inference for Topic Models
224,http://proceedings.mlr.press/v97/ghorbani19b/ghorbani19b.pdf,e75694d685a8c203672d40c0b4f5435284b724b0,An Investigation into Neural Net Optimization via Hessian Eigenvalue Density
225,http://proceedings.mlr.press/v97/ghorbani19c/ghorbani19c.pdf,8788be59ff869af4d8b3b75091b1af521ba7fc7c,Data Shapley: Equitable Valuation of Data for Machine Learning
226,http://proceedings.mlr.press/v97/gilboa19a/gilboa19a.pdf,856a7bfa8afd261efcbf352a6529ccea9009253f,Efficient Dictionary Learning with Gradient Descent
227,http://proceedings.mlr.press/v97/gillenwater19a/gillenwater19a.pdf,01480b47ede09de14bef5f406f970ac81454bb97,A Tree-Based Method for Fast Repeated Sampling of Determinantal Point Processes
228,http://proceedings.mlr.press/v97/gillick19a/gillick19a.pdf,8b60f3f9e6cc380e872dd739a69103b0393be0c6,Learning to Groove with Inverse Sequence Transformations
229,http://proceedings.mlr.press/v97/gilmer19a/gilmer19a.pdf,08c2997e9d1134a48d6d22bd8aa70268c8bbf17e,Adversarial Examples Are a Natural Consequence of Test Error in Noise
230,http://proceedings.mlr.press/v97/gimenez19a/gimenez19a.pdf,daad4e7da2ab6598e0b050b5a44931f16f355ed5,Discovering Conditionally Salient Features with Statistical Guarantees
231,http://proceedings.mlr.press/v97/goldfeld19a/goldfeld19a.pdf,becdef144056465ecdcc6c8e158bb8f499b6c982,Estimating Information Flow in Deep Neural Networks
232,http://proceedings.mlr.press/v97/golinski19a/golinski19a.pdf,48bc103780093c5fcdd8c9c7c65e2f3ed18c777f,Amortized Monte Carlo Integration
233,http://proceedings.mlr.press/v97/gollapudi19a/gollapudi19a.pdf,5ee408f638d9b82e48d2c6a1c979628b66b617b4,Online Algorithms for Rent-Or-Buy with Expert Advice
234,http://proceedings.mlr.press/v97/golovnev19a/golovnev19a.pdf,3e790ffa427cf8145c9c8f668389a3685a5b478f,The information-theoretic value of unlabeled data in semi-supervised learning
235,http://proceedings.mlr.press/v97/gong19a/gong19a.pdf,7274e3d3bc24a2ca9997304af8ef1c9b26efbdd8,Efficient Training of BERT by Progressively Stacking
236,http://proceedings.mlr.press/v97/gong19b/gong19b.pdf,c703252f10b0ecda91e5889935f9045faf67b856,Quantile Stein Variational Gradient Descent for Batch Bayesian Optimization
237,http://proceedings.mlr.press/v97/gordaliza19a/gordaliza19a.pdf,6751a060c75664560e36c98fbc6edc15677131b6,Obtaining Fairness using Optimal Transport Theory
238,http://proceedings.mlr.press/v97/gottesman19a/gottesman19a.pdf,9e1db1abac01f15a44fc45028ae9a2f911952323,Combining parametric and nonparametric models for off-policy evaluation
239,http://proceedings.mlr.press/v97/goyal19a/goyal19a.pdf,a5834b75087d958c7b9275d4c7c032bdaac35d99,Counterfactual Visual Explanations
240,http://proceedings.mlr.press/v97/grant19a/grant19a.pdf,4b4ff9ab85d18bf20019dc70968ac84bd4d237c6,Adaptive Sensor Placement for Continuous Spaces
241,http://proceedings.mlr.press/v97/greaves-tunnell19a/greaves-tunnell19a.pdf,25a7676a73a54259faa549bc24835000fd1ed334,A Statistical Investigation of Long Memory in Language and Music
242,http://proceedings.mlr.press/v97/greenberg19a/greenberg19a.pdf,b76bb9e3b77c103fb24524f05c8b6955327aae3e,Automatic Posterior Transformation for Likelihood-Free Inference
243,http://proceedings.mlr.press/v97/greenfeld19a/greenfeld19a.pdf,7d450378c395c3697e7c0c7405b07c033fae79d8,Learning to Optimize Multigrid PDE Solvers
244,http://proceedings.mlr.press/v97/greff19a/greff19a.pdf,1ff58dc141b8d4d450f2e5e25dc1014216c0f628,Multi-Object Representation Learning with Iterative Variational Inference
245,http://proceedings.mlr.press/v97/grover19a/grover19a.pdf,91ab954354a66bf3aa75ecfebef5ae02e7ef1f2e,Graphite: Iterative Generative Modeling of Graphs
246,http://proceedings.mlr.press/v97/gu19a/gu19a.pdf,f233b0bfc7b70e35473caef47861ff40d65c0f17,Fast Algorithm for Generalized Multinomial Models with Ranking Data
247,http://proceedings.mlr.press/v97/guan19a/guan19a.pdf,b726bbc834e068454b70fee06d313797a59f8925,Towards a Deep and Unified Understanding of Deep Neural Models in NLP
248,http://proceedings.mlr.press/v97/guez19a/guez19a.pdf,a7dd61b0273dfbf076c8a303f6d6db1f9f868a23,An Investigation of Model-Free Planning
249,http://proceedings.mlr.press/v97/gultchin19a/gultchin19a.pdf,6c9ab89a921331800da526aae74b8b42b53ad7ca,Humor in Word Embeddings: Cockamamie Gobbledegook for Nincompoops
250,http://proceedings.mlr.press/v97/guo19a/guo19a.pdf,fca860e4ee80ccf41a8d526046916f2c38b51b4a,Simple Black-box Adversarial Attacks
251,http://proceedings.mlr.press/v97/guo19b/guo19b.pdf,6e55008d931f6b60624987376cd309f4513db6c6,Exploring interpretable LSTM neural networks over multi-variable data
252,http://proceedings.mlr.press/v97/guo19c/guo19c.pdf,f03c02540eeeeaffe77016ad2742b0ca7a890988,Learning to Exploit Long-term Relational Dependencies in Knowledge Graphs
253,http://proceedings.mlr.press/v97/gural19a/gural19a.pdf,2e16a51fe52eea2d0c5dde9e74cfc9c6e867104c,Memory-Optimal Direct Convolutions for Maximizing Classification Accuracy in Embedded Applications
254,http://proceedings.mlr.press/v97/haber19a/haber19a.pdf,68e470b08d56ca2b098e18c66dc609cfb8d57ce6,IMEXnet A Forward Stable Deep Neural Network
255,http://proceedings.mlr.press/v97/hacohen19a/hacohen19a.pdf,1c764d3b2caf1bd1ec106d40318f07a233d0326c,On The Power of Curriculum Learning in Training Deep Networks
256,http://proceedings.mlr.press/v97/haddadpour19a/haddadpour19a.pdf,b7c7236adfe2523fffee87e16c571fbc8383c856,Trading Redundancy for Communication: Speeding up Distributed SGD for Non-convex Optimization
257,http://proceedings.mlr.press/v97/hafner19a/hafner19a.pdf,e586593d7d776d31a9ba3c8daac8fed323dab448,Learning Latent Dynamics for Planning from Pixels
258,http://proceedings.mlr.press/v97/halperin19a/halperin19a.pdf,45135e07828af8479f9a860e52cb442f04376f5a,Neural Separation of Observed and Unobserved Distributions
259,http://proceedings.mlr.press/v97/han19a/han19a.pdf,627dea1896d9505149ebc145ccf203bfe34e54c7,Grid-Wise Control for Multi-Agent Reinforcement Learning in Video Game AI
260,http://proceedings.mlr.press/v97/han19b/han19b.pdf,a492aa44c5e8a7af2ad26d816093910406a31906,Dimension-Wise Importance Sampling Weight Clipping for Sample-Efficient Reinforcement Learning
261,http://proceedings.mlr.press/v97/hanin19a/hanin19a.pdf,153b0958c987672571c37a881ff2274a8706e8c1,Complexity of Linear Regions in Deep Networks
262,http://proceedings.mlr.press/v97/hanna19a/hanna19a.pdf,e5058493214c7627d0fa0a53b025031042cb8b5f,Importance Sampling Policy Evaluation with an Estimated Behavior Policy
263,http://proceedings.mlr.press/v97/hao19a/hao19a.pdf,638b44a4b96d7d8eac72d4775003ffc1267c8339,Doubly-Competitive Distribution Estimation
264,http://proceedings.mlr.press/v97/haochen19a/haochen19a.pdf,68784deac54dc1a992b9755e05ca8b0d384b5791,Random Shuffling Beats SGD after Finite Epochs
265,http://proceedings.mlr.press/v97/harshaw19a/harshaw19a.pdf,758dcf6024cf8cb08c4ff7aed45d9ba6ae8fe126,"Submodular Maximization beyond Non-negativity: Guarantees, Fast Algorithms, and Applications"
266,http://proceedings.mlr.press/v97/harutyunyan19a/harutyunyan19a.pdf,ce229f0fa7f89b9791c1674fed45e39faa4f8be3,Per-Decision Option Discounting
267,http://proceedings.mlr.press/v97/hashemi19a/hashemi19a.pdf,0ec61c906c6f958369439c1503b85e1f6e485b92,Submodular Observation Selection and Information Gathering for Quadratic Models
268,http://proceedings.mlr.press/v97/haviv19a/haviv19a.pdf,a9915d560a50b61d80fdecf07dc549763dcab0bf,Understanding and Controlling Memory in Recurrent Neural Networks
269,http://proceedings.mlr.press/v97/hayou19a/hayou19a.pdf,36d07b15a2085f115c81ef28e5a6e159dfe7db27,On the Impact of the Activation function on Deep Neural Networks Training
270,http://proceedings.mlr.press/v97/hazan19a/hazan19a.pdf,539d23a14ba855bd25ac865788e66a87a419b2de,Provably Efficient Maximum Entropy Exploration
271,http://proceedings.mlr.press/v97/heidari19a/heidari19a.pdf,23eed660c23063efb3cb63032fa10be51625fa07,On the Long-term Impact of Algorithmic Decision Policies: Effort Unfairness and Feature Segregation through Social Learning
272,http://proceedings.mlr.press/v97/hendrickx19a/hendrickx19a.pdf,36648bbb44e63f15a027e94cdcaf3ba6455fcdd1,Graph Resistance and Learning from Pairwise Comparisons
273,http://proceedings.mlr.press/v97/hendrycks19a/hendrycks19a.pdf,e302f624d8dce9fd1852de22d226d6d031216f54,Using Pre-Training Can Improve Model Robustness and Uncertainty
274,http://proceedings.mlr.press/v97/ho19a/ho19a.pdf,29223ad325c8e29b1988f451af6e9613280b4059,Flow++: Improving Flow-Based Generative Models with Variational Dequantization and Architecture Design
275,http://proceedings.mlr.press/v97/ho19b/ho19b.pdf,613a2376ac5a1003a3085f6ccbc80ac34c2ad67a,Population Based Augmentation: Efficient Learning of Augmentation Policy Schedules
276,http://proceedings.mlr.press/v97/hoang19a/hoang19a.pdf,05a9d6e3674175bec05f6c04e17038f8a75bd56a,Collective Model Fusion for Multiple Black-Box Experts
277,http://proceedings.mlr.press/v97/hofer19a/hofer19a.pdf,b5a1b95f6751342a0a062f4143eb0d8edb706284,Connectivity-Optimized Representation Learning via Persistent Homology
278,http://proceedings.mlr.press/v97/holland19a/holland19a.pdf,dbd91236be3f75bf5ab662e8f520c3aa0f52039a,Better generalization with less data using robust gradient descent
279,http://proceedings.mlr.press/v97/hoogeboom19a/hoogeboom19a.pdf,2fb255ca92bc9d811e374606784388a202e33852,Emerging Convolutions for Generative Normalizing Flows
280,http://proceedings.mlr.press/v97/horvath19a/horvath19a.pdf,d8142ab2ece6c9a41935a8405e1c78e9d134f87d,Nonconvex Variance Reduced Optimization with Arbitrary Sampling
281,http://proceedings.mlr.press/v97/houlsby19a/houlsby19a.pdf,83263b137e581dce1ee18e9a01e866f5f6b6773e,Parameter-Efficient Transfer Learning for NLP
282,http://proceedings.mlr.press/v97/hsieh19a/hsieh19a.pdf,7ed80cf041f0180cdad87e81331cf1719f8a8d9a,Stay With Me: Lifetime Maximization Through Heteroscedastic Linear Bandits With Reneging
283,http://proceedings.mlr.press/v97/hsieh19b/hsieh19b.pdf,f479c1ca62f019a27b9002e6f21834b1b57be408,Finding Mixed Nash Equilibria of Generative Adversarial Networks
284,http://proceedings.mlr.press/v97/hsieh19c/hsieh19c.pdf,0b1ed742d80e2a2b98f81d26c5d0f238fb3f032a,"Classification from Positive, Unlabeled and Biased Negative Data"
285,http://proceedings.mlr.press/v97/hsu19a/hsu19a.pdf,cb415a9fb536f5a7ef0059d5363970eb75c2ae0f,Bayesian Deconditional Kernel Mean Embeddings
286,http://proceedings.mlr.press/v97/huang19a/huang19a.pdf,ad8dc69fb58db104591ba5d6d01af054e2ee2932,Faster Stochastic Alternating Direction Method of Multipliers for Nonconvex Optimization
287,http://proceedings.mlr.press/v97/huang19b/huang19b.pdf,ab4d5b7f2b3b82e2ccb7e5ee98ac0b68d6704acb,Unsupervised Deep Learning by Neighbourhood Discovery
288,http://proceedings.mlr.press/v97/huang19c/huang19c.pdf,c5d090305d040f74cb96d74b45ec30a03716760b,Detecting Overlapping and Correlated Communities without Pure Nodes: Identifiability and Algorithm
289,http://proceedings.mlr.press/v97/huang19d/huang19d.pdf,8dd06e20ae14d46f623e3d859f83fc0f3d5f10b7,Hierarchical Importance Weighted Autoencoders
290,http://proceedings.mlr.press/v97/huang19e/huang19e.pdf,bb5acf53de8f1ff7e2c5d3ff8733a5688ab1cfa9,Stable and Fair Classification
291,http://proceedings.mlr.press/v97/huang19f/huang19f.pdf,8a30456c60b335cfe1afdc303b286c15946379b9,Addressing the Loss-Metric Mismatch with Adaptive Loss Alignment
292,http://proceedings.mlr.press/v97/huang19g/huang19g.pdf,d81dc85f94f74dd216234c07d47386f3f2f15b92,Causal Discovery and Forecasting in Nonstationary Environments with State-Space Models
293,http://proceedings.mlr.press/v97/hunt19a/hunt19a.pdf,681add12a8d2074e07e0551b88dd0e4d0b954f2e,Composing Entropic Policies using Divergence Correction
294,http://proceedings.mlr.press/v97/hwang19a/hwang19a.pdf,ef5bad2c02134bd0e136b7c6cf5a914e173f96f6,HexaGAN: Generative Adversarial Nets for Real World Classification
295,http://proceedings.mlr.press/v97/ialongo19a/ialongo19a.pdf,3e0d0a3b9cd31c3cc6edb5e3532fedd5299e6fea,Overcoming Mean-Field Approximations in Recurrent Gaussian Process Models
296,http://proceedings.mlr.press/v97/innes19a/innes19a.pdf,00c6f751b2be6a62b478cd7523da6129ccdf1419,Learning Structured Decision Problems with Unawareness
297,http://proceedings.mlr.press/v97/ipsen19a/ipsen19a.pdf,4582563d63c2e70b8d6399a858c39e1596e779d2,"Phase transition in PCA with missing data: Reduced signal-to-noise ratio, not sample size!"
298,http://proceedings.mlr.press/v97/iqbal19a/iqbal19a.pdf,d93b555d85ad05e669c1361d31487490dba34848,Actor-Attention-Critic for Multi-Agent Reinforcement Learning
299,http://proceedings.mlr.press/v97/ishida19a/ishida19a.pdf,1b762d63bd8dfff7a03a90e7d9334fc9d9fc02a3,Complementary-Label Learning for Arbitrary Losses and Models
300,http://proceedings.mlr.press/v97/jaber19a/jaber19a.pdf,9a7cb87544b0dc87b353c3237141f1c4e91893c5,Causal Identification under Markov Equivalence: Completeness Results
301,http://proceedings.mlr.press/v97/jacq19a/jacq19a.pdf,aece9f4a1f9df2b7e02f059cea06cb279386f866,Learning from a Learner
302,http://proceedings.mlr.press/v97/jagielski19a/jagielski19a.pdf,c396c6a4c35fb49a6c6181c976c041f55f4f3e7f,Differentially Private Fair Learning
303,http://proceedings.mlr.press/v97/jaini19a/jaini19a.pdf,8266a7f06204d862a6b4b326ae9b08e360499b43,Sum-of-Squares Polynomial Flow
304,http://proceedings.mlr.press/v97/jang19a/jang19a.pdf,b51735b6b19c0f70c1010648166d429f857dc84e,DBSCAN++: Towards fast and scalable density clustering
305,http://proceedings.mlr.press/v97/jang19b/jang19b.pdf,b9a063dda02af28029818f2ce33ac34cc2a77350,Learning What and Where to Transfer
306,http://proceedings.mlr.press/v97/jaques19a/jaques19a.pdf,9e8d04a4879290dde541219e49aaf926b8f62372,Social Influence as Intrinsic Motivation for Multi-Agent Deep Reinforcement Learning
307,http://proceedings.mlr.press/v97/jay19a/jay19a.pdf,f369e194dff3a3f681cd8f70d4bc37e000eded33,A Deep Reinforcement Learning Perspective on Internet Congestion Control
308,http://proceedings.mlr.press/v97/jeong19a/jeong19a.pdf,590387e3ea6f497440f5b276c7fd112ef3b86ff1,Graph Neural Network for Music Score Data and Modeling Expressive Piano Performance
309,http://proceedings.mlr.press/v97/jeong19b/jeong19b.pdf,2f67faff128890e3186fe3e0d68e865abcc0c737,Ladder Capsule Network
310,http://proceedings.mlr.press/v97/jeong19c/jeong19c.pdf,e5fe095029688c61d2cd52e7be87c4ff3a04dd0d,Training CNNs with Selective Allocation of Channels
311,http://proceedings.mlr.press/v97/jeong19d/jeong19d.pdf,a518b5408605a20329561c2b559b10258632cff5,Learning Discrete and Continuous Factors of Data via Alternating Disentanglement
312,http://proceedings.mlr.press/v97/ji19a/ji19a.pdf,7be1bbe6efcedf528042ac22cc31fd45402c1bc0,Improved Zeroth-Order Variance Reduced Algorithms and Analysis for Nonconvex Optimization
313,http://proceedings.mlr.press/v97/jiang19a/jiang19a.pdf,47a04c8c1ef6abd8454ba02fdac102d1fc2ec68b,Neural Logic Reinforcement Learning
