,Link,Name,Title
314,http://proceedings.mlr.press/v97/jinnai19a/jinnai19a.pdf,1b453db4b3b95343bfd867c923eb23d3e09c094d,Finding Options that Minimize Planning Time
315,http://proceedings.mlr.press/v97/jinnai19b/jinnai19b.pdf,c20639d3f3fcbf694dd06ef69ca0b0471a907ae4,Discovering Options for Exploration by Minimizing Cover Time
316,http://proceedings.mlr.press/v97/jitkrittum19a/jitkrittum19a.pdf,89847b40b4b39ae0d034fdf445db5cf0c8d7a7ab,Kernel Mean Matching for Content Addressability of GANs
317,http://proceedings.mlr.press/v97/john19a/john19a.pdf,95564d8ca2c4544c81ded590ccd12aeb6e47046b,GOODE: A Gaussian Off-The-Shelf Ordinary Differential Equation Solver
318,http://proceedings.mlr.press/v97/jun19a/jun19a.pdf,d73da963420ccf930ac1ffdb9a39f1434abebb57,Bilinear Bandits with Low-rank Structure
319,http://proceedings.mlr.press/v97/kahng19a/kahng19a.pdf,bf49a0ab5ebbd981f4ef5a67f27e6e0d85e6b9f4,Statistical Foundations of Virtual Democracy
320,http://proceedings.mlr.press/v97/kajino19a/kajino19a.pdf,64103cb2ff7c69107f1464890cdddd97abe904f1,Molecular Hypergraph Grammar with Its Application to Molecular Optimization
321,http://proceedings.mlr.press/v97/kalimeris19a/kalimeris19a.pdf,9cec9f32a3d96a713971b9bcf046374d21b264aa,Robust Influence Maximization for Hyperparametric Models
322,http://proceedings.mlr.press/v97/kallus19a/kallus19a.pdf,242cab902c7f60c4d904a02c9af1989f1d9118e4,Classifying Treatment Responders Under Causal Effect Monotonicity
323,http://proceedings.mlr.press/v97/kalyan19a/kalyan19a.pdf,4b1ccba00d31b5512679e26d3ab6fb885772c2b9,Trainable Decoding of Sets of Sequences for Neural Sequence Models
324,http://proceedings.mlr.press/v97/kandasamy19a/kandasamy19a.pdf,d0596c4fbc0afc6db82066e75abf76e3259f045a,Myopic Posterior Sampling for Adaptive Goal Oriented Design of Experiments
325,http://proceedings.mlr.press/v97/kaplan19a/kaplan19a.pdf,af2fe721953d68fbe1144f062e7124d2f1ec1fc9,Differentially Private Learning of Geometric Concepts
326,http://proceedings.mlr.press/v97/kaplanis19a/kaplanis19a.pdf,06de0836f7a19ae1cf03cbeec8a180599c2b5719,Policy Consolidation for Continual Reinforcement Learning
327,http://proceedings.mlr.press/v97/karimireddy19a/karimireddy19a.pdf,c3e10ccb62e2dfccc07f4a0cd89a7768e7505dca,Error Feedback Fixes SignSGD and other Gradient Compression Schemes
328,http://proceedings.mlr.press/v97/kasai19a/kasai19a.pdf,e253cb003f2970e1c73dd1c69cbe3fd344a3356b,Riemannian adaptive stochastic gradient algorithms on matrix manifolds
329,http://proceedings.mlr.press/v97/kaspar19a/kaspar19a.pdf,45df3439edc97d859428d3d3bc8aabb8f7db6cd6,Neural Inverse Knitting: From Images to Manufacturing Instructions
330,http://proceedings.mlr.press/v97/katharopoulos19a/katharopoulos19a.pdf,d9cad1302c17398f798e83a677a17bbbd6e8b7ea,Processing Megapixel Images with Deep Attention-Sampling Models
331,http://proceedings.mlr.press/v97/katiyar19a/katiyar19a.pdf,f31e35a2e56ad8d81a95b2c76204cf471253e57b,Robust Estimation of Tree Structured Gaussian Graphical Models
332,http://proceedings.mlr.press/v97/kaya19a/kaya19a.pdf,c65a579d5648f1a9a85faf94707c6956d1d835cb,Shallow-Deep Networks: Understanding and Mitigating Network Overthinking
333,http://proceedings.mlr.press/v97/kazemi19a/kazemi19a.pdf,e70ab3d9530f04d91b4590b0e711a58968e60844,"Submodular Streaming in All Its Glory: Tight Approximation, Minimum Memory and Low Adaptive Complexity"
334,http://proceedings.mlr.press/v97/kempka19a/kempka19a.pdf,f193e392024ac991ebe10a1a6da8fd0979a42eed,Adaptive Scale-Invariant Online Algorithms for Learning Linear Models
335,http://proceedings.mlr.press/v97/kenter19a/kenter19a.pdf,948c7cda9a67e84a931a9a92c5f492c660e3db3b,CHiVE: Varying Prosody in Speech Synthesis with a Linguistically Driven Dynamic Hierarchical Conditional Variational Network
336,http://proceedings.mlr.press/v97/khadka19a/khadka19a.pdf,593ec98bba7bfa52899dc549b374942f9d30606e,Collaborative Evolutionary Reinforcement Learning
337,http://proceedings.mlr.press/v97/khasanova19a/khasanova19a.pdf,a81c9921b35fa0d1a6987d6f123258360f6a189e,Geometry Aware Convolutional Filters for Omnidirectional Images Representation
338,http://proceedings.mlr.press/v97/kim19a/kim19a.pdf,64e6415435a62c2f4f38c3dfe5242abbffa45621,EMI: Exploration with Mutual Information
339,http://proceedings.mlr.press/v97/kim19b/kim19b.pdf,02aeb9078a85a80fbdbe6c3412aa574838386726,FloWaveNet : A Generative Flow for Raw Audio
340,http://proceedings.mlr.press/v97/kim19c/kim19c.pdf,fefbe96832889a8e17e38b32f31cbc9b97266fc0,Curiosity-Bottleneck: Exploration By Distilling Task-Specific Novelty
341,http://proceedings.mlr.press/v97/kim19d/kim19d.pdf,5d6b10cbf2c77020c5e54bc6deadaa716318a210,Contextual Multi-armed Bandit Algorithm for Semiparametric Reward Model
342,http://proceedings.mlr.press/v97/kim19e/kim19e.pdf,5d7faf7d26455e078709536debffe4f6bdb03688,Uniform Convergence Rate of the Kernel Density Estimator Adaptive to Intrinsic Volume Dimension
343,http://proceedings.mlr.press/v97/kingma19a/kingma19a.pdf,1a62ebd825d766d80d247f767a092cf5f73bddf8,Bit-Swap: Recursive Bits-Back Coding for Lossless Compression with Hierarchical Latent Variables
344,http://proceedings.mlr.press/v97/kipf19a/kipf19a.pdf,83755d31a452bd4031e2c364bdedca6ffb3ac206,CompILE: Compositional Imitation Learning and Execution
345,http://proceedings.mlr.press/v97/kirschner19a/kirschner19a.pdf,c30e2141af2e7c52becb53ae83b171afb55706e1,Adaptive and Safe Bayesian Optimization in High Dimensions via One-Dimensional Subspaces
346,http://proceedings.mlr.press/v97/kleiman19a/kleiman19a.pdf,9a0d517903530f84b06e71de853de7d95c8b06f1,AUC\xce\xbc: A Performance Metric for Multi-Class Machine Learning Models
347,http://proceedings.mlr.press/v97/kleindessner19a/kleindessner19a.pdf,91c871a03fe616fe10c589d6b6faf30b23e9a89a,Fair k-Center Clustering for Data Summarization
348,http://proceedings.mlr.press/v97/kleindessner19b/kleindessner19b.pdf,9c23dc540b4905c39ec3d01757b46e67736b4d6f,Guarantees for Spectral Clustering with Fairness Constraints
349,http://proceedings.mlr.press/v97/ko19a/ko19a.pdf,9eb2e137250b6356b3a3c6ba0c7ae69048884112,POPQORN: Quantifying Robustness of Recurrent Neural Networks
350,http://proceedings.mlr.press/v97/koloskova19a/koloskova19a.pdf,dfa15c95e330f374f58b196f170999158cf16848,Decentralized Stochastic Optimization and Gossip Algorithms with Compressed Communication
351,http://proceedings.mlr.press/v97/konstantinov19a/konstantinov19a.pdf,833ceafb8075d3b4ca6117322d615b24b2ff66fe,Robust Learning from Untrusted Sources
352,http://proceedings.mlr.press/v97/kool19a/kool19a.pdf,731d044870357a401bd2005dcd9ca71926f23264,Stochastic Beams and Where To Find Them: The Gumbel-Top-k Trick for Sampling Sequences Without Replacement
353,http://proceedings.mlr.press/v97/koratana19a/koratana19a.pdf,955d5c11771e09243e776fda1286c4beb8267adf,LIT: Learned Intermediate Representation Training for Model Compression
354,http://proceedings.mlr.press/v97/kornblith19a/kornblith19a.pdf,d96d528c4e0dac57e0b1016c71eb797eddae175c,Similarity of Neural Network Representations Revisited
355,http://proceedings.mlr.press/v97/kroshnin19a/kroshnin19a.pdf,1ba3eb4533212e7ebd7b0e306451b052aaa244e5,On the Complexity of Approximating Wasserstein Barycenters
356,http://proceedings.mlr.press/v97/kulunchakov19a/kulunchakov19a.pdf,a7314322561dd5aff612102fb9bac6ec8e01dc8c,Estimate Sequences for Variance-Reduced Stochastic Composite Optimization
357,http://proceedings.mlr.press/v97/kumar19a/kumar19a.pdf,ff8c05cee403290edf5eba8753134883997aeffa,Faster Algorithms for Binary Matrix Factorization
358,http://proceedings.mlr.press/v97/kunin19a/kunin19a.pdf,2d70f1012b57166eb47451ec4568682c2b694172,Loss Landscapes of Regularized Linear Autoencoders
359,http://proceedings.mlr.press/v97/kuo19a/kuo19a.pdf,d596c7cfd0e014a323a3a359cab97de075d1692e,Geometry and Symmetry in Short-and-Sparse Deconvolution
360,http://proceedings.mlr.press/v97/kurach19a/kurach19a.pdf,19b57ae1b84da50ea5669301677c8806f2fa9bac,A Large-Scale Study on Regularization and Normalization in GANs
361,http://proceedings.mlr.press/v97/kusner19a/kusner19a.pdf,b4d0f36d05db0b4a2ef1b30a5615323cc197066e,Making Decisions that Reduce Discriminatory Impacts
362,http://proceedings.mlr.press/v97/kveton19a/kveton19a.pdf,3916ce241efad91382c5f60303697cdd44043db7,"Garbage In, Reward Out: Bootstrapping Exploration in Multi-Armed Bandits"
363,http://proceedings.mlr.press/v97/labatie19a/labatie19a.pdf,c3f7209cfb0643c50628d320887f8c44caf6bd8c,Characterizing Well-Behaved vs. Pathological Deep Neural Networks
364,http://proceedings.mlr.press/v97/lamb19a/lamb19a.pdf,1c0267f9abf4f5b0f8912f300828cb8f30690594,State-Reification Networks: Improving Generalization by Modeling the Distribution of Hidden Representations
365,http://proceedings.mlr.press/v97/lamprier19a/lamprier19a.pdf,37a82c02f6a3391560b91679d01e5951c616965a,A Recurrent Neural Cascade-based Model for Continuous-Time Diffusion
366,http://proceedings.mlr.press/v97/lange19a/lange19a.pdf,93ff95f2fb5c78a0ded0ff5161b308daa73419ed,Projection onto Minkowski Sums with Application to Constrained Learning
367,http://proceedings.mlr.press/v97/laroche19a/laroche19a.pdf,c83c70fd851625be81655901a10a950ad4ccf817,Safe Policy Improvement with Baseline Bootstrapping
368,http://proceedings.mlr.press/v97/lattanzi19a/lattanzi19a.pdf,b1e083ec8757e68e8226a674c5b143564e299583,A Better k-means++ Algorithm via Local Search
369,http://proceedings.mlr.press/v97/law19a/law19a.pdf,c0c06837345f845a75feb404f3549340c603d316,Lorentzian Distance Learning for Hyperbolic Representations
370,http://proceedings.mlr.press/v97/lawrence19a/lawrence19a.pdf,5ce9e41905394d946a79ae13ddb9d7a88ffe84fb,DP-GP-LVM: A Bayesian Non-Parametric Model for Learning Multivariate Dependency Structures
371,http://proceedings.mlr.press/v97/lazic19a/lazic19a.pdf,f82ca1bd02215550dacfb17a8165937c158772f9,POLITEX: Regret Bounds for Policy Iteration using Expert Prediction
372,http://proceedings.mlr.press/v97/le19a/le19a.pdf,cfe955e6992a4cce3e2b726a299fdee18f44f99f,Batch Policy Learning under Constraints
373,http://proceedings.mlr.press/v97/lee19a/lee19a.pdf,f8edc34dce4b6eb6d8953287e7742b8346b51239,Target-Based Temporal-Difference Learning
374,http://proceedings.mlr.press/v97/lee19b/lee19b.pdf,d031e18f17afa7b7988811f63a9835825ddf36a7,Functional Transparency for Structured Data: a Game-Theoretic Approach
375,http://proceedings.mlr.press/v97/lee19c/lee19c.pdf,50a0b1469c38057425af066fb00c5e6ad218f0ce,Self-Attention Graph Pooling
376,http://proceedings.mlr.press/v97/lee19d/lee19d.pdf,66298d625b15ace754f7763c5fdba97f44092989,Set Transformer: A Framework for Attention-based Permutation-Invariant Neural Networks
377,http://proceedings.mlr.press/v97/lee19e/lee19e.pdf,e06262bdb0222a42ee80f1c7cdd9e9b5966a3160,First-Order Algorithms Converge Faster than $O(1/k)$ on Convex Problems
378,http://proceedings.mlr.press/v97/lee19f/lee19f.pdf,27060f2a20a88bb1ab8b95a86e1f6ace52bcbf70,Robust Inference via Generative Classifiers for Handling Noisy Labels
379,http://proceedings.mlr.press/v97/lei19a/lei19a.pdf,a2bfc74e2583fcde5e8c3df8cfa903f9b67bb33c,Sublinear Time Nearest Neighbor Search over Generalized Weighted Space
380,http://proceedings.mlr.press/v97/lerasle19a/lerasle19a.pdf,b415fc8265b3ab1be64c6be7b2b2d784b7d0c83a,MONK Outlier-Robust Mean Embedding Estimation by Median-of-Means
381,http://proceedings.mlr.press/v97/lezcano-casado19a/lezcano-casado19a.pdf,3eeaf7498cc53225986419bccb43953e8c8f73fa,Cheap Orthogonal Constraints in Neural Networks: A Simple Parametrization of the Orthogonal and Unitary Group
382,http://proceedings.mlr.press/v97/li19a/li19a.pdf,5509367bd0507dd5100d313ed9f0d052c61acb3d,Are Generative Classifiers More Robust to Adversarial Attacks?
383,http://proceedings.mlr.press/v97/li19b/li19b.pdf,c12894cc306c8c2c2d204de70cb90991f7127fe7,Sublinear quantum algorithms for training linear and kernel-based classifiers
384,http://proceedings.mlr.press/v97/li19c/li19c.pdf,e21b9a603a2d44b27551eb32a59f844313a06cf8,LGM-Net: Learning to Generate Matching Networks for Few-Shot Learning
385,http://proceedings.mlr.press/v97/li19d/li19d.pdf,3ddd4f19a8ea473928c760e6e32be0d72b6ceb05,Graph Matching Networks for Learning the Similarity of Graph Structured Objects
386,http://proceedings.mlr.press/v97/li19e/li19e.pdf,2502230eb1093c514b86718cbd14605b6731bb9d,Area Attention
387,http://proceedings.mlr.press/v97/li19f/li19f.pdf,73794be9475aadd1f33efae44259c3c603f514a6,Online Learning to Rank with Features
388,http://proceedings.mlr.press/v97/li19g/li19g.pdf,1ece3d384eb30b1ae2f4681fce1b0128d8f89d23,NATTACK: Learning the Distributions of Adversarial Examples for an Improved Black-Box Attack on Deep Neural Networks
389,http://proceedings.mlr.press/v97/li19h/li19h.pdf,cc4ed77de0b6841650900ec0a32c9c32e638dc7e,Bayesian Joint Spike-and-Slab Graphical Lasso
390,http://proceedings.mlr.press/v97/li19i/li19i.pdf,fc4044fb00ef3143625a3f3fdeac52e3ee7514cb,Exploiting Worker Correlation for Label Aggregation in Crowdsourcing
391,http://proceedings.mlr.press/v97/li19j/li19j.pdf,8ada8e563fc363e6578b66ed10b97c92d8f72616,Adversarial camera stickers: A physical camera-based attack on deep learning systems
392,http://proceedings.mlr.press/v97/li19k/li19k.pdf,9e1acc71d26f36aa78166488acf4b9c23a7a51e8,Towards a Unified Analysis of Random Fourier Features
393,http://proceedings.mlr.press/v97/li19l/li19l.pdf,81053e1a4597b9f043565931b084059abdf4b366,Feature-Critic Networks for Heterogeneous Domain Generalization
394,http://proceedings.mlr.press/v97/li19m/li19m.pdf,a3ff6a941c0d4139a99a9496efcb107c35418c8e,Learn to Grow: A Continual Structure Learning Framework for Overcoming Catastrophic Forgetting
395,http://proceedings.mlr.press/v97/li19n/li19n.pdf,508eba3aefeb232e346ef0e52b89d8a036c09257,Alternating Minimizations Converge to Second-Order Optimal Solutions
396,http://proceedings.mlr.press/v97/liakopoulos19a/liakopoulos19a.pdf,2d5ffc5be6feb2b28f31bb737616db06cb2d06c9,Cautious Regret Minimization: Online Optimization with Long-Term Budget Constraints
397,http://proceedings.mlr.press/v97/lichtenberg19a/lichtenberg19a.pdf,52c1088f08a097ee3db220fa07743c1fa504d069,Regularization in directable environments with application to Tetris
398,http://proceedings.mlr.press/v97/likhosherstov19a/likhosherstov19a.pdf,d72bbfd5f66624b0d1ecd62e0661d889b31c666c,Inference and Sampling of $K_33$-free Ising Models
399,http://proceedings.mlr.press/v97/lim19a/lim19a.pdf,e9e22fcc8e69e32121a540e80c911985f026b2ef,Kernel-Based Reinforcement Learning in Robust Markov Decision Processes
400,http://proceedings.mlr.press/v97/lin19a/lin19a.pdf,b0e1b48ca5513efef6d59653f1951020cfe86f75,On Efficient Optimal Transport: An Analysis of Greedy and Accelerated Mirror Descent Algorithms
401,http://proceedings.mlr.press/v97/lin19b/lin19b.pdf,6e3836b7ac84f3258126843945607fcd2b6fd9ee,Fast and Simple Natural-Gradient Variational Inference with Mixture of Exponential-family Approximations
402,http://proceedings.mlr.press/v97/liu19a/liu19a.pdf,62a04ce0dd05b074c3e43c0b38b8b94b255b5f94,Acceleration of SVRG and Katyusha X by Inexact Preconditioning
403,http://proceedings.mlr.press/v97/liu19b/liu19b.pdf,427ba9f88363995e57463b5a3ae5b6bdb367fbab,Transferable Adversarial Training: A General Approach to Adapting Deep Classifiers
404,http://proceedings.mlr.press/v97/liu19c/liu19c.pdf,c55faaacbc5812150ffcac46006398308dac0a0e,Rao-Blackwellized Stochastic Gradients for Discrete Distributions
405,http://proceedings.mlr.press/v97/liu19d/liu19d.pdf,1f8375182a66eecf08c7d1c24103c4542ff5bd11,Sparse Extreme Multi-label Learning with Oracle Property
406,http://proceedings.mlr.press/v97/liu19e/liu19e.pdf,38dcfc20d17f53a99185fd1baadd5795c2b44a34,Data Poisoning Attacks on Stochastic Bandits
407,http://proceedings.mlr.press/v97/liu19f/liu19f.pdf,f6630f8fa7b04ce38948653a2379411a8dc7c6b1,The Implicit Fairness Criterion of Unconstrained Learning
408,http://proceedings.mlr.press/v97/liu19g/liu19g.pdf,dded2856251c14e5444de8be1abc8f2b65d8f6e2,Taming MAML: Efficient unbiased meta-reinforcement learning
409,http://proceedings.mlr.press/v97/liu19h/liu19h.pdf,dadae2338ce7ff81c2a0c1d1ccf14b80b0b6100b,On Certifying Non-Uniform Bounds against Adversarial Attacks
410,http://proceedings.mlr.press/v97/liu19i/liu19i.pdf,35b2cfb1cc44e941585372bdd7b0aae1f33ee98a,Understanding and Accelerating Particle-Based Variational Inference
411,http://proceedings.mlr.press/v97/liu19j/liu19j.pdf,b2aecc8a01deb644590fe9b15d242b7b227dee5a,Understanding MCMC Dynamics as Flows on the Wasserstein Space
412,http://proceedings.mlr.press/v97/liutkus19a/liutkus19a.pdf,51c57f698342159cf07aacfd38a44718d71cf776,Sliced-Wasserstein Flows: Nonparametric Generative Modeling via Optimal Transport and Diffusions
413,http://proceedings.mlr.press/v97/locatello19a/locatello19a.pdf,cd0d2b598bf1909ee4863c6a3d673402d6067181,Challenging Common Assumptions in the Unsupervised Learning of Disentangled Representations
414,http://proceedings.mlr.press/v97/london19a/london19a.pdf,10f3e34cf785b962ec1011d7c12df7b482efb071,Bayesian Counterfactual Risk Minimization
415,http://proceedings.mlr.press/v97/lu19a/lu19a.pdf,c72470d2b70854766791a21bd88529d3d1a5671d,PA-GD: On the Convergence of Perturbed Alternating Gradient Descent to Second-Order Stationary Points for Structured Nonconvex Optimization
416,http://proceedings.mlr.press/v97/lu19b/lu19b.pdf,afdbb79f0a635b712d40e0ce7ad1d6cf727afe5f,Neurally-Guided Structure Inference
417,http://proceedings.mlr.press/v97/lu19c/lu19c.pdf,7c960b5702551095429d538d1f1507a2a1da08fc,Optimal Algorithms for Lipschitz Bandits with Heavy-tailed Rewards
418,http://proceedings.mlr.press/v97/lu19d/lu19d.pdf,02f02422a57518c2b4ca78b42cb95c32e4622944,CoT: Cooperative Training for Generative Modeling of Discrete Data
419,http://proceedings.mlr.press/v97/lucibello19a/lucibello19a.pdf,7339644e4f4dab8dcc45324bf1c0432f60845f41,Generalized Approximate Survey Propagation for High-Dimensional Estimation
420,http://proceedings.mlr.press/v97/lucic19a/lucic19a.pdf,be05af0d12661423d85165bc229d5a0f40e8f896,High-Fidelity Image Generation With Fewer Labels
421,http://proceedings.mlr.press/v97/luise19a/luise19a.pdf,e1338c4eeda3b1b5b4800310a62e8e08e1441a27,Leveraging Low-Rank Relations Between Surrogate Tasks in Structured Prediction
422,http://proceedings.mlr.press/v97/luo19a/luo19a.pdf,689bdb8511fc05f33b0261fa2aa7df6a07a7e518,Differentiable Dynamic Normalization for Learning Deep Representation
423,http://proceedings.mlr.press/v97/ma19a/ma19a.pdf,a59e62f96e6e2478fa40520c975220ddaa11841f,Disentangled Graph Convolutional Networks
424,http://proceedings.mlr.press/v97/ma19b/ma19b.pdf,112259af4b9f05b075df071aaeda11795e235ebc,Variational Implicit Processes
425,http://proceedings.mlr.press/v97/ma19c/ma19c.pdf,f19158382abf811957ca1ee899f1b0910f61423e,EDDI: Efficient Dynamic Discovery of High-Value Information with Partial VAE
426,http://proceedings.mlr.press/v97/magnusson19a/magnusson19a.pdf,33965aa9b07636ed0068207d1bc322e5e50a0681,Bayesian leave-one-out cross-validation for large data
427,http://proceedings.mlr.press/v97/mahabadi19a/mahabadi19a.pdf,aea847b2a96f6771b077c12aa49e584456f6461a,Composable Core-sets for Determinant Maximization: A Simple Near-Optimal Algorithm
428,http://proceedings.mlr.press/v97/maheswaranathan19a/maheswaranathan19a.pdf,113849249f2e636a0aeae4766c2d634df418a2c2,Guided evolutionary strategies: augmenting random search with surrogate gradients
429,http://proceedings.mlr.press/v97/mahloujifar19a/mahloujifar19a.pdf,c2e8e29a92e228eaaa218646d2b6534b5cabd8ed,Data Poisoning Attacks in Multi-Party Learning
430,http://proceedings.mlr.press/v97/mahoney19a/mahoney19a.pdf,13b75dd8b62cdf350ec29cb342eb37f5360f8418,Traditional and Heavy Tailed Self Regularization in Neural Network Models
431,http://proceedings.mlr.press/v97/mai19a/mai19a.pdf,5e4590d8605fa32b3fcf53c3ef0ef7d46622927e,Curvature-Exploiting Acceleration of Elastic Net Computations
432,http://proceedings.mlr.press/v97/makkuva19a/makkuva19a.pdf,643058e44d6bfe0fe69b2812e56aa9024ea83f0b,Breaking the gridlock in Mixture-of-Experts: Consistent and Efficient Algorithms
433,http://proceedings.mlr.press/v97/malik19a/malik19a.pdf,76c7789046d9a6120ffaa8e984413c8b13b3ee61,Calibrated Model-Based Deep Reinforcement Learning
434,http://proceedings.mlr.press/v97/mann19a/mann19a.pdf,fb93af5e75727c3bbecf4e04d11a836fa8d47801,Learning from Delayed Outcomes via Proxies with Applications to Recommender Systems
435,http://proceedings.mlr.press/v97/mannelli19a/mannelli19a.pdf,61adaec0da9da7bb8f5867925173b8eeabffce1f,Passed & Spurious: Descent Algorithms and Local Minima in Spiked Matrix-Tensor Models
436,http://proceedings.mlr.press/v97/mao19a/mao19a.pdf,9b206f31f07688483b4de909ff926f179f9b8c89,A Baseline for Any Order Gradient Estimation in Stochastic Computation Graphs
437,http://proceedings.mlr.press/v97/marafioti19a/marafioti19a.pdf,2ef607f444a54a2e646bbc5ff2b1452531bbd36a,Adversarial Generation of Time-Frequency Features with application in audio synthesis
438,http://proceedings.mlr.press/v97/maron19a/maron19a.pdf,72f10f85afa69f333739c0243983f89e10951623,On the Universality of Invariant Networks
439,http://proceedings.mlr.press/v97/martens19a/martens19a.pdf,da834078172e2dc1b8a73c4e50d946ad78e017de,Decomposing feature-level variation with Covariate Gaussian Process Latent Variable Models
440,http://proceedings.mlr.press/v97/mary19a/mary19a.pdf,d7e242678866117c7b5327ba429ff06a18f49c6e,Fairness-Aware Learning for Continuous Attributes and Treatments
441,http://proceedings.mlr.press/v97/mathiasen19a/mathiasen19a.pdf,d24a8a7b5ff126948b11b379a918f8f0980264a8,Optimal Minimal Margin Maximization with Boosting
442,http://proceedings.mlr.press/v97/mathieu19a/mathieu19a.pdf,78a4c93208ad461d9b0acdcf63ace0606c503b29,Disentangling Disentanglement in Variational Autoencoders
443,http://proceedings.mlr.press/v97/mattei19a/mattei19a.pdf,86ac0b3ba4a4c97e808667ce38d5800217abf046,MIWAE: Deep Generative Modelling and Imputation of Incomplete Data Sets
444,http://proceedings.mlr.press/v97/mavrin19a/mavrin19a.pdf,ce4b6a7c1c9f6297b2a0bd2c0a171513778e5dc8,Distributional Reinforcement Learning for Efficient Exploration
445,http://proceedings.mlr.press/v97/mckenna19a/mckenna19a.pdf,cbf703ba00d8d766ccf84fc6d44cc952fb4d0f40,Graphical-model based estimation and inference for differential privacy
446,http://proceedings.mlr.press/v97/meeds19a/meeds19a.pdf,d9e417c7102460de057af3bf73cca420b75bf0a0,Efficient Amortised Bayesian Inference for Hierarchical and Nonlinear Dynamical Systems
447,http://proceedings.mlr.press/v97/mehrotra19a/mehrotra19a.pdf,22b53e9f1c487a62295c55cc84c0e63a04b1642f,Toward Controlling Discrimination in Online Ad Auctions
448,http://proceedings.mlr.press/v97/mehta19a/mehta19a.pdf,bdb7ebcb59d223194bff1a243cdb06a8c24b0285,Stochastic Blockmodels meet Graph Neural Networks
449,http://proceedings.mlr.press/v97/mei19a/mei19a.pdf,78160acf29b0982c60b888f3d386292a15f79dc0,Imputing Missing Events in Continuous-Time Event Streams
450,http://proceedings.mlr.press/v97/meller19a/meller19a.pdf,6447dcc34a1d0a69e7a49b54954797c96ca0d73d,"Same, Same But Different: Recovering Neural Network Quantization Error Through Weight Factorization"
451,http://proceedings.mlr.press/v97/memoli19a/memoli19a.pdf,e9abfa1ce2646f2e95b9019a12cf03ec81cd489d,The Wasserstein Transform
452,http://proceedings.mlr.press/v97/mendis19a/mendis19a.pdf,9ff6cc1656a59015c47e8794565a692676fb5e48,"Ithemal: Accurate, Portable and Fast Basic Block Throughput Estimation using Deep Neural Networks"
453,http://proceedings.mlr.press/v97/mensch19a/mensch19a.pdf,38512d7aeb52bbcc5fee6560dce51d0b3a0a1b38,Geometric Losses for Distributional Learning
454,http://proceedings.mlr.press/v97/mercado19a/mercado19a.pdf,2e9edbc73db3f31649b7874663b7305800d2e7c8,Spectral Clustering of Signed Graphs via Matrix Power Means
455,http://proceedings.mlr.press/v97/metel19a/metel19a.pdf,abb7969246a77e24766a7d9419bb87f04f0743b9,Simple Stochastic Gradient Methods for Non-Smooth Non-Convex Regularized Optimization
456,http://proceedings.mlr.press/v97/metelli19a/metelli19a.pdf,11dc8dc094701dfcc47b9e56ad4b4938677d867d,Reinforcement Learning in Configurable Continuous Environments
457,http://proceedings.mlr.press/v97/metz19a/metz19a.pdf,ab568a352bb7fd153c904f52321f1fed374421f6,Understanding and correcting pathologies in the training of learned optimizers
458,http://proceedings.mlr.press/v97/meyer19a/meyer19a.pdf,367971efcc976ae7a2300b8a6faa0d48eaa4d487,Optimality Implies Kernel Sum Classifiers are Statistically Efficient
459,http://proceedings.mlr.press/v97/mianjy19a/mianjy19a.pdf,88a5bbb44eb16e81db25315065ef5978bf69ac31,On Dropout and Nuclear Norm Regularization
460,http://proceedings.mlr.press/v97/miller19a/miller19a.pdf,650955bdb87254c9241f5d3164ce33ec1a2d96c1,Discriminative Regularization for Latent Variable Models with Applications to Electrocardiography
461,http://proceedings.mlr.press/v97/mirshani19a/mirshani19a.pdf,221aeb466c87d24e04b217d8601771a7b4b8fb73,Formal Privacy for Functional Data with Gaussian Perturbations
462,http://proceedings.mlr.press/v97/mishne19a/mishne19a.pdf,a1a129867d2aaae5e0d0cf936804e61824a28723,Co-manifold learning with missing data
463,http://proceedings.mlr.press/v97/mohri19a/mohri19a.pdf,fdedea09a874f7690acb5c2e796e978721375ba3,Agnostic Federated Learning
464,http://proceedings.mlr.press/v97/mollenhoff19a/mollenhoff19a.pdf,ddf869681c36077fbbf8346af8fa41f7212b930c,Flat Metric Minimization with Applications in Generative Modeling
465,http://proceedings.mlr.press/v97/moon19a/moon19a.pdf,a78b5b827c50c7b49c724284ffce6ee8f51e19af,Parsimonious Black-Box Adversarial Attacks via Efficient Combinatorial Optimization
466,http://proceedings.mlr.press/v97/mostafa19a/mostafa19a.pdf,7b742050f3dbc6a3250058885c7c197eed43944a,Parameter efficient training of deep convolutional neural networks by dynamic sparse reparameterization
467,http://proceedings.mlr.press/v97/muehlebach19a/muehlebach19a.pdf,fd9ae41b0c0fc9b55db77cabf3242cda344258dd,A Dynamical Systems Perspective on Nesterov Acceleration
